{
  "op": "core.fetchCustomerByLoanRequest",
  "kind": "HTTP",
  "resource": "core",
  "params": { "loanRequestId": { "type": "string" } },
  "request": {
    "method": "GET",
    "path": "=env.customerDataPath",
    "query": { "loanRequestIds": "=params.loanRequestId", "loanIds": "", "lpLoanIds": "", "uLoanIds": "", "uLpLoanIds": "" }
  },
  "success": "resp.status == 200 && resp.body.?loandata.orValue([]).size() > 0",
  "classify": "resp.status == 200 ? 'PERMANENT' : resp.status >= 500 ? 'TECHNICAL' : 'BUSINESS'",
  "out": { "customer": "resp.body.loandata[0].customer" },
  "required": ["customer"]
}
