{
  "op": "axis.precheck.saveDedupe",
  "kind": "MONGO",
  "resource": "lendercore-mongo",
  "params": {
    "loanRequestId": {
      "type": "string"
    },
    "lender": {
      "type": "string"
    },
    "customerId": {
      "type": "string"
    },
    "applicantId": {
      "type": "string"
    },
    "clientLoanId": {
      "type": "string"
    }
  },
  "collection": "LenderCustomerPrecheck",
  "action": "UPSERT",
  "filter": {
    "loanRequestId": ":loanRequestId",
    "lenderSlug": ":lender"
  },
  "setOnInsert": {
    "customerId": ":customerId",
    "responseMap": {},
    "creation_date": ":sys.now",
    "createdAt": ":sys.now",
    "_class": "com.rupeek.lender.entity.PrecheckEntity"
  },
  "set": {
    "applicantId": ":applicantId",
    "clientLoanId": ":clientLoanId",
    "precheckStatus": "processed",
    "approved": false,
    "last_updated": ":sys.now"
  },
  "inc": {
    "version": 1
  },
  "out": {
    "matched": "result.matched"
  }
}
