{
  "op": "map.axis.precheckStatusRequest",
  "kind": "MAP",
  "resource": "axis-precheck",
  "params": {
    "doc": {
      "type": "map"
    }
  },
  "template": {
    "agreement_id": "=env.preCheckAgreementId",
    "customer_id": "=rk.str(params.doc.?customerId.orValue(null))",
    "application_id": "=rk.str(params.doc.?applicantId.orValue(null))",
    "client_loan_id": "=rk.str(params.doc.?clientLoanId.orValue(null))",
    "model_name": "CLM1",
    "customer_type": "individual",
    "first_name": null,
    "middle_name": null,
    "last_name": null,
    "name_as_per_pan": null,
    "date_of_birth": null,
    "date_of_birth_as_per_pan": null,
    "mobile_number": null,
    "email": null,
    "gender": null,
    "dedupe_type": null,
    "aadhar_number": null,
    "dedupe_ids": null,
    "address": null
  },
  "out": {
    "value": "result"
  }
}
