{
  "op": "precheck.audit.insert",
  "kind": "MONGO",
  "resource": "lendercore-mongo",
  "params": {
    "loanRequestId": {
      "type": "string"
    },
    "lender": {
      "type": "string"
    },
    "customerId": {
      "type": "string"
    },
    "loanProcess": {
      "type": "string"
    },
    "status": {
      "type": "string"
    },
    "remarks": {
      "type": "string"
    }
  },
  "collection": "LenderCustomerPrecheckAudit",
  "action": "INSERT",
  "set": {
    "loanRequestId": ":loanRequestId",
    "customerId": ":customerId",
    "lenderSlug": ":lender",
    "responseMap": {},
    "loanProcess": ":loanProcess",
    "precheckStatus": ":status",
    "remarks": ":remarks",
    "createdOn": ":sys.now",
    "lastUpdatedOn": ":sys.now",
    "version": 0,
    "creation_date": ":sys.now",
    "createdAt": ":sys.now",
    "last_updated": ":sys.now",
    "_class": "com.rupeek.lender.entity.PrecheckAuditEntity"
  },
  "out": {
    "inserted": "result.inserted"
  }
}
